{
  "taskId": "3.3",
  "autonomyLevel": 2,
  "decisions": [
    {
      "id": "D1",
      "title": "Deterministic provider mocks for Gemini and Turbotext with configurable scenarios",
      "isKey": true
    },
    {
      "id": "S1",
      "title": "Added pytest fixtures and contract tests exercising provider mocks",
      "isKey": false
    }
  ],
  "architectureChanges": [],
  "fileChanges": [
    {
      "path": "tests/mocks/providers.py",
      "change": "added",
      "summary": "Introduce MockGeminiProvider/MockTurbotextProvider with success/timeout/error modes"
    },
    {
      "path": "tests/contract/test_provider_mocks.py",
      "change": "added",
      "summary": "Add contract coverage for mock providers including cancel idempotency"
    },
    {
      "path": "tests/contract/test_queue_worker.py",
      "change": "modified",
      "summary": "Use provider mocks and assert cancel events"
    },
    {
      "path": "tests/conftest.py",
      "change": "modified",
      "summary": "Expose mock_gemini_provider and mock_turbotext_provider fixtures"
    },
    {
      "path": ".memory/WORKLOG.md",
      "change": "modified",
      "summary": "Added phase3-provider-mocks execution log"
    },
    {
      "path": ".memory/TASKS.md",
      "change": "modified",
      "summary": "Marked subtask 3.3 and sub-items as complete"
    },
    {
      "path": ".memory/PROGRESS.md",
      "change": "modified",
      "summary": "Logged completion of provider mock subtask"
    },
    {
      "path": ".memory/ASKS.md",
      "change": "modified",
      "summary": "Recorded ASK-0008 as done"
    },
    {
      "path": "REPORT.md",
      "change": "added",
      "summary": "Documented textual report per template"
    },
    {
      "path": "REPORT.json",
      "change": "modified",
      "summary": "Updated report metadata for task 3.3"
    }
  ],
  "risks": [
    "Environment lacks fastapi/pydantic/httpx, so mypy and pytest fail with import errors"
  ],
  "artifacts": {
    "contracts": "No contract changes required",
    "tests": "pytest -q -m unit / contract / contract and integration fail: missing fastapi",
    "decisions": "No ADR updates needed",
    "progress": ".memory/PROGRESS.md updated for 3.3",
    "tasks": ".memory/TASKS.md marks subtask 3.3 as done"
  },
  "nextSteps": [
    "Install fastapi, pydantic, httpx dependencies to unblock mypy/pytest",
    "Proceed to task 3.4 (TTL cleanup unit tests)"
  ]
}
